{
  "schema": "https://jkolantree.github.io/astra/schemas/dark-medium-response-atlas-visual-review-v1.schema.json",
  "file": "dark-medium-response-atlas-v0.1.0.pdf",
  "sha256": "9e8688b2831762d71037452ecef733c750d951cf5d65c18a84e5a2a0cd956d91",
  "render_dpi": 160,
  "page_count": 28,
  "reviewed_pages": [
    {"page": 1, "render": "page-0001.png", "bytes": 87546, "sha256": "60be58a2bf5c888f653a29256d6c4ef21468d81b6af5550e78f11dfa9c337a8f", "status": "PASS", "notes": ["Title, status notice, and opening navigation are readable."]},
    {"page": 2, "render": "page-0002.png", "bytes": 341281, "sha256": "f172923e97e7ffb067f7ef49b1c3acd19eab18814c7f5bfc09d2452d996fba24", "status": "PASS", "notes": ["Summary and introductory prose are readable without clipping."]},
    {"page": 3, "render": "page-0003.png", "bytes": 416545, "sha256": "ca518645aae700cdf09205f0e34ec286790554bdf18d2f9ad1b39f50fcd66bf7", "status": "PASS", "notes": ["Headings, equations, and body text render legibly."]},
    {"page": 4, "render": "page-0004.png", "bytes": 335144, "sha256": "21c72b555865f8da4b656dfc7b922a8f7061a0fb53fe2f6ee0c04f91c08ef5e2", "status": "PASS", "notes": ["Section transition and mathematical display are readable."]},
    {"page": 5, "render": "page-0005.png", "bytes": 320144, "sha256": "c280ea018e9e92f3c37d7e872dd5a95ed11c480b4f07995e7a3f770b4750fb4a", "status": "PASS", "notes": ["Text and equations remain within page bounds."]},
    {"page": 6, "render": "page-0006.png", "bytes": 321517, "sha256": "a50235dc3eb69723ae1657294f83856497a36938ba1657a0e948de8fe0e14b96", "status": "PASS", "notes": ["Numbered sections and displayed notation are legible."]},
    {"page": 7, "render": "page-0007.png", "bytes": 182961, "sha256": "69a3375987aa18684aa7bcf27ff850a238620037c3071d6cac6d9174e207f9e4", "status": "PASS", "notes": ["Whitespace is intentional; no stranded heading, clipping, or overflow observed."]},
    {"page": 8, "render": "page-0008.png", "bytes": 316840, "sha256": "278b6ac9b050b5da3d92f9f22067dbeb2b3e4f11f733bc6560cf6b0ddedb4e9d", "status": "PASS", "notes": ["Prose, headings, and inline notation are readable."]},
    {"page": 9, "render": "page-0009.png", "bytes": 328743, "sha256": "d5d4535364a46cf46cd37cf3b0b7c5404cea815a6ee143d4030b5e4789b056d4", "status": "PASS", "notes": ["Page layout and equation line breaking are readable."]},
    {"page": 10, "render": "page-0010.png", "bytes": 233806, "sha256": "f0d7a1f5e8ad55e7436c81d5b25334771b14d731fa88081e93ee52948dc9acb2", "status": "PASS", "notes": ["Section heading and paragraph rhythm are readable."]},
    {"page": 11, "render": "page-0011.png", "bytes": 257407, "sha256": "f3ddffb39c7bb4cb88dcaf8f4279d5d9d4d1417d894d52cb38cdb22ba2c6b224", "status": "PASS", "notes": ["Mathematical symbols and body text are readable."]},
    {"page": 12, "render": "page-0012.png", "bytes": 259653, "sha256": "e7b33405aac408a9028b38682225a7d86b97a4dee4d5236b8399a3b1b8327b0c", "status": "PASS", "notes": ["No clipped footers, equations, or running content observed."]},
    {"page": 13, "render": "page-0013.png", "bytes": 344749, "sha256": "a4cecca1fe8b76a9321bc42eb219c3b4a07e7c09fab70ac3fdc6b439c0f00a2f", "status": "PASS", "notes": ["Dense explanatory text remains readable at the review resolution."]},
    {"page": 14, "render": "page-0014.png", "bytes": 317078, "sha256": "c718fcce25d39e39fed7940523dadaa013182c81b0a30228db019682aac1295b", "status": "PASS", "notes": ["Heading hierarchy and equation placement are readable."]},
    {"page": 15, "render": "page-0015.png", "bytes": 343466, "sha256": "6defdde30e7ffc02e999a6b64962f0119eba051c1026bdb757704ba9bc73598d", "status": "PASS", "notes": ["Table-like material and body text are readable."]},
    {"page": 16, "render": "page-0016.png", "bytes": 286985, "sha256": "c3abd7f9e874160828486decf9914b512a0f5db59936837a095c31d8831f2466", "status": "PASS", "notes": ["Page breaks preserve readable section continuity."]},
    {"page": 17, "render": "page-0017.png", "bytes": 360845, "sha256": "1f594a63ad9d4c1ac18ea1646c98bb1f7c5cd474bfd7f49ec4862ab88f4a93b3", "status": "PASS", "notes": ["Text, equations, and links are visually unobstructed."]},
    {"page": 18, "render": "page-0018.png", "bytes": 382875, "sha256": "597facf278a1e05bd9fd4b988dace57e208316d7d4e7e8bf1146e1c4708881e0", "status": "PASS", "notes": ["No equation clipping or overlap observed."]},
    {"page": 19, "render": "page-0019.png", "bytes": 390711, "sha256": "f13688840740234399cbbb9979b359f020a4397e9c65e8375ac61d6544b7aa87", "status": "PASS", "notes": ["Readable dense prose and stable margins observed."]},
    {"page": 20, "render": "page-0020.png", "bytes": 315862, "sha256": "c4297621e0656ea83d19c19e9d54fab85418419e73ea83e77045dc5f381f7573", "status": "PASS", "notes": ["Section heading and display math remain readable."]},
    {"page": 21, "render": "page-0021.png", "bytes": 315971, "sha256": "58e64a06d662bd8609f5652ddd85b0a6e812eb2c427996e8b650b8e545aa2ed2", "status": "PASS", "notes": ["Prose and notation are readable with no observed overflow."]},
    {"page": 22, "render": "page-0022.png", "bytes": 375287, "sha256": "aac76f82f5fac78bb7391f717bd7ffcea93d21eed81babf4a9657dfa380f55c6", "status": "PASS", "notes": ["Table content and surrounding text remain legible."]},
    {"page": 23, "render": "page-0023.png", "bytes": 347678, "sha256": "0654789bb105f91c44c0a580f80af19bf29e05a4d68df6d3df2a84c24c315eb3", "status": "PASS", "notes": ["No broken visual hierarchy or clipping observed."]},
    {"page": 24, "render": "page-0024.png", "bytes": 403016, "sha256": "737b744abc80aa7c612c8e15e8e83df3560c9bd7a7e0f973bbd43d62aafacc1e", "status": "PASS", "notes": ["Split phase-coordinate display is readable with no clipping."]},
    {"page": 25, "render": "page-0025.png", "bytes": 405692, "sha256": "ea31ec1d223b27cc2929dade76dc311aaa4607080acfeec05f5f28756e6ea8cc", "status": "PASS", "notes": ["Long-form discussion and equations remain readable."]},
    {"page": 26, "render": "page-0026.png", "bytes": 352087, "sha256": "7eb4ef0d04e42fe61227d5d4e3e2959f8ef4c200a832686d62642dc68a4231f7", "status": "PASS", "notes": ["References and surrounding content are readable."]},
    {"page": 27, "render": "page-0027.png", "bytes": 411596, "sha256": "671a5e28ea8edf40ced0593594cd77a516a19d140ff20c8f87e5d432a2a215c3", "status": "PASS", "notes": ["Bibliography layout is readable without visible overflow."]},
    {"page": 28, "render": "page-0028.png", "bytes": 186288, "sha256": "cf06c890ba23f2948607a7f1f572c97d253242a89ff864c118c40c15e4e9da1a", "status": "PASS", "notes": ["Closing references and rights material are readable."]}
  ],
  "inspection_scope": [
    "typography",
    "equations",
    "clipping",
    "overflow",
    "stranded_headings",
    "contrast",
    "link_annotations",
    "metadata",
    "page_numbering",
    "readability"
  ],
  "reviewed_at": "2026-09-01",
  "reviewer": "Codex rendered-page inspection",
  "result": "PASS",
  "limitations": [
    "Rendered-page inspection at 160 DPI; this is not a PDF/UA conformance claim.",
    "The review does not establish scientific correctness, external-link availability, peer review, or publication status."
  ]
}
